{
  "contrato": "CTR-05",
  "contratoVersion": 1,
  "juego": "adivinar-tapa",
  "actualizado": "2026-08-21",
  "items": [
    {
      "id": "TP-001",
      "us": [
        "US-04"
      ],
      "dificultad": "facil",
      "imagen": {
        "archivo": "gulp-zoom",
        "encuadre": "detalle",
        "disco": "Gulp!",
        "edicion": "LP argentino, sello Wormo, 1985",
        "auditoria": "coincide con la original, sin marcador que lo pruebe",
        "credito": {
          "autor": "Rocambole (Ricardo Cohen)",
          "origen": "coveralia"
        }
      },
      "opciones": [
        {
          "texto": "Gulp!",
          "correcta": true
        },
        {
          "texto": "Oktubre",
          "correcta": false
        },
        {
          "texto": "Un baión para el ojo idiota",
          "correcta": false
        },
        {
          "texto": "¡Bang! ¡Bang!... Estás liquidado",
          "correcta": false
        }
      ],
      "explicacion": "Lo que está pintado a mano no es el título: es el nombre de la banda. Rocambole lo hizo con un tubo de plasticola cargado de esmalte sintético, y de ahí lo pasaron a serigrafía sobre seda, en tres pasadas.",
      "fuentes": [
        "RES-44",
        "RES-02",
        "RES-33"
      ],
      "sensibleA": [
        "tapa"
      ],
      "estado": "listo",
      "notaInterna": "Ciclo 9, 2026-08-28, pedido del usuario: el juego funciona como los juegos de splash — no se muestra la tapa entera nunca, se muestra un zoom alto. El lado del recorte sale de la dificultad del item (facil 0.40 del master, media 0.26, dificil 0.22), asi que BR-01 escalona de verdad y no solo por que tapa toca. De paso muere el defecto anterior: si el titulo impreso no entra en el recorte, no hay nada que leer. Los centros estan en scripts/generar-tapas.mjs y le deben una entrada a UX-05."
    },
    {
      "id": "TP-002",
      "us": [
        "US-04"
      ],
      "dificultad": "facil",
      "imagen": {
        "archivo": "oktubre-zoom",
        "encuadre": "detalle",
        "disco": "Oktubre",
        "edicion": "LP/casete argentino, sellos Wormo y Del Cielito, 1986",
        "auditoria": "coincide con la original, sin marcador que lo pruebe",
        "credito": {
          "autor": "Rocambole (Ricardo Cohen)",
          "origen": "coveralia"
        }
      },
      "opciones": [
        {
          "texto": "Oktubre",
          "correcta": true
        },
        {
          "texto": "Gulp!",
          "correcta": false
        },
        {
          "texto": "Un baión para el ojo idiota",
          "correcta": false
        },
        {
          "texto": "Luzbelito",
          "correcta": false
        }
      ],
      "explicacion": "Esa multitud de caras grises bajo las banderas rojas es el motivo central de la tapa. El título queda fuera del recorte, y vale saber cómo está escrito: con un alfabeto que Rocambole inventó a mano, de aire cirílico y con una B espejada. No deriva de ninguna tipografía existente — venía de su oficio anterior de cartelista.",
      "rotulo": {
        "tipo": "leyenda",
        "texto": "Que el alfabeto fue un homenaje a la Revolución Rusa de 1917 circula consistente en varias fuentes, pero sale de una entrevista de 1999 sin verificar en fuente primaria (RES-06)."
      },
      "fuentes": [
        "RES-44",
        "RES-02",
        "RES-31",
        "RES-06"
      ],
      "sensibleA": [
        "tapa"
      ],
      "estado": "listo",
      "notaInterna": "Ciclo 9, 2026-08-28, pedido del usuario: el juego funciona como los juegos de splash — no se muestra la tapa entera nunca, se muestra un zoom alto. El lado del recorte sale de la dificultad del item (facil 0.40 del master, media 0.26, dificil 0.22), asi que BR-01 escalona de verdad y no solo por que tapa toca. De paso muere el defecto anterior: si el titulo impreso no entra en el recorte, no hay nada que leer. Los centros estan en scripts/generar-tapas.mjs y le deben una entrada a UX-05."
    },
    {
      "id": "TP-003",
      "us": [
        "US-04"
      ],
      "dificultad": "facil",
      "imagen": {
        "archivo": "luzbelito-zoom",
        "encuadre": "detalle",
        "disco": "Luzbelito",
        "edicion": "CD argentino, sello Del Cielito, 1996",
        "auditoria": "coincide con la original, sin marcador que lo pruebe",
        "credito": {
          "autor": "Rocambole (Ricardo Cohen)",
          "origen": "coveralia"
        }
      },
      "opciones": [
        {
          "texto": "Luzbelito",
          "correcta": true
        },
        {
          "texto": "Último bondi a Finisterre",
          "correcta": false
        },
        {
          "texto": "Momo Sampler",
          "correcta": false
        },
        {
          "texto": "Oktubre",
          "correcta": false
        }
      ],
      "explicacion": "Esta tapa le ganó a Rocambole el premio ACE al mejor diseño de portada de disco.",
      "fuentes": [
        "RES-44",
        "RES-02",
        "RES-06"
      ],
      "sensibleA": [
        "tapa"
      ],
      "estado": "listo",
      "notaInterna": "Ciclo 9, 2026-08-28, pedido del usuario: el juego funciona como los juegos de splash — no se muestra la tapa entera nunca, se muestra un zoom alto. El lado del recorte sale de la dificultad del item (facil 0.40 del master, media 0.26, dificil 0.22), asi que BR-01 escalona de verdad y no solo por que tapa toca. De paso muere el defecto anterior: si el titulo impreso no entra en el recorte, no hay nada que leer. Los centros estan en scripts/generar-tapas.mjs y le deben una entrada a UX-05."
    },
    {
      "id": "TP-004",
      "us": [
        "US-04"
      ],
      "dificultad": "media",
      "imagen": {
        "archivo": "un-baion-para-el-ojo-idiota-zoom",
        "encuadre": "detalle",
        "disco": "Un baión para el ojo idiota",
        "edicion": "LP argentino, sello Wormo, 1988",
        "auditoria": "coincide con la original, sin marcador que lo pruebe",
        "credito": {
          "autor": "Rocambole (Ricardo Cohen)",
          "origen": "coveralia"
        }
      },
      "opciones": [
        {
          "texto": "Un baión para el ojo idiota",
          "correcta": true
        },
        {
          "texto": "¡Bang! ¡Bang!... Estás liquidado",
          "correcta": false
        },
        {
          "texto": "Gulp!",
          "correcta": false
        },
        {
          "texto": "La mosca y la sopa",
          "correcta": false
        }
      ],
      "explicacion": "El televisor es 'el ojo idiota'. El muñeco con antifaz y chupete es la hija de Rocambole, Marilú, disfrazada; el perro apareció después, porque para él hay un perro en toda la mitología solariana.",
      "rotulo": {
        "tipo": "testimonio",
        "texto": "Lo cuenta el Indio Solari citando a Rocambole en sus memorias 'Recuerdos que mienten un poco' (2019)."
      },
      "fuentes": [
        "RES-44",
        "RES-02",
        "RES-22"
      ],
      "sensibleA": [
        "tapa"
      ],
      "estado": "listo",
      "notaInterna": "Ciclo 9, 2026-08-28, pedido del usuario: el juego funciona como los juegos de splash — no se muestra la tapa entera nunca, se muestra un zoom alto. El lado del recorte sale de la dificultad del item (facil 0.40 del master, media 0.26, dificil 0.22), asi que BR-01 escalona de verdad y no solo por que tapa toca. De paso muere el defecto anterior: si el titulo impreso no entra en el recorte, no hay nada que leer. Los centros estan en scripts/generar-tapas.mjs y le deben una entrada a UX-05."
    },
    {
      "id": "TP-005",
      "us": [
        "US-04"
      ],
      "dificultad": "media",
      "imagen": {
        "archivo": "bang-bang-estas-liquidado-zoom",
        "encuadre": "detalle",
        "disco": "¡Bang! ¡Bang!... Estás liquidado",
        "edicion": "LP argentino, sello Del Cielito, 1989",
        "auditoria": "coincide con la original, sin marcador que lo pruebe",
        "credito": {
          "autor": "Rocambole (Ricardo Cohen)",
          "origen": "coveralia"
        }
      },
      "opciones": [
        {
          "texto": "¡Bang! ¡Bang!... Estás liquidado",
          "correcta": true
        },
        {
          "texto": "Un baión para el ojo idiota",
          "correcta": false
        },
        {
          "texto": "La mosca y la sopa",
          "correcta": false
        },
        {
          "texto": "Oktubre",
          "correcta": false
        }
      ],
      "explicacion": "Salió por Del Cielito en 1989, el año antes de que la banda tocara por primera vez fuera de la Argentina, en Montevideo.",
      "fuentes": [
        "RES-44",
        "RES-02",
        "RES-05"
      ],
      "sensibleA": [
        "tapa"
      ],
      "estado": "listo",
      "notaInterna": "Ciclo 9, 2026-08-28, pedido del usuario: el juego funciona como los juegos de splash — no se muestra la tapa entera nunca, se muestra un zoom alto. El lado del recorte sale de la dificultad del item (facil 0.40 del master, media 0.26, dificil 0.22), asi que BR-01 escalona de verdad y no solo por que tapa toca. De paso muere el defecto anterior: si el titulo impreso no entra en el recorte, no hay nada que leer. Los centros estan en scripts/generar-tapas.mjs y le deben una entrada a UX-05."
    },
    {
      "id": "TP-006",
      "us": [
        "US-04"
      ],
      "dificultad": "media",
      "imagen": {
        "archivo": "ultimo-bondi-a-finisterre-zoom",
        "encuadre": "detalle",
        "disco": "Último bondi a Finisterre",
        "edicion": "CD argentino, sello Patricio Rey Discos, 1998",
        "auditoria": "coincide con la original, sin marcador que lo pruebe",
        "credito": {
          "autor": "Rocambole (Ricardo Cohen)",
          "origen": "coveralia"
        }
      },
      "opciones": [
        {
          "texto": "Último bondi a Finisterre",
          "correcta": true
        },
        {
          "texto": "Momo Sampler",